{
  "type": "manufacturing.batch.completed.v1",
  "event_id": "10000000-0000-4000-8000-000000000001",
  "run_id": "20000000-0000-4000-8000-000000000001",
  "epoch": "30000000-0000-4000-8000-000000000001",
  "correlation_id": "40000000-0000-4000-8000-000000000001",
  "aggregate_id": "50000000-0000-4000-8000-000000000001",
  "aggregate_version": 4,
  "simulation_time": 38,
  "payload": {
    "product": "PRODUCT",
    "line": "LINE-1",
    "quantity": 4,
    "output_quantity": 3,
    "scrap_quantity": 1
  }
}
